Seed Round - Houseware,https://www.crunchbase.com/funding_round/houseware-seed--286190c1,Houseware,https://www.crunchbase.com/organization/houseware,Seed,2100000,USD,2100000,2023-03-09,Tanglin Venture Partners,"Better Capital, GTMfund, Tanglin Venture Partners",Seed,,,,Yes,"Houseware is a modern revenue engine for B2B SaaS to work with metrics, build intelligent workflows & drive predictable revenue outcomes.",Software,,"San Francisco, California, United States, North America",https://houseware-inc.us,$1M to $10M,2100000,USD,2100000,Seed,1,3,4,"121,425"
Seed Round - Renegade,https://www.crunchbase.com/funding_round/renegade-428c-seed--9147456a,Renegade,https://www.crunchbase.com/organization/renegade-428c,Seed,3400000,USD,3400000,2023-02-20,"Dragonfly, Naval Ravikant","Balaji Srinivasan, Dragonfly, Lev Livnev, Marc Bhargava, Naval Ravikant, Robot Ventures",Seed,,,,Yes,Renegade is an on-chain crypto dark pool that maintains complete anonymity during the entire lifecycle of a trade.,"Cryptocurrency, Financial Exchanges",,"San Francisco, California, United States, North America",https://renegade.fi,,3400000,USD,3400000,Seed,1,6,,"121,507"
Seed Round - TakeProfit,https://www.crunchbase.com/funding_round/takeprofit-seed--8a53a94d,TakeProfit,https://www.crunchbase.com/organization/takeprofit,Seed,3000000,USD,3000000,2022-07-05,"Alexander Bachmann, Lime Financial","Alexander Bachmann, Lime Financial",Seed,,,,Yes,TakeProfit is a community-driven trading platform aiming to beat the smart money at their own game.,"Financial Services, Information Technology",,"San Francisco, California, United States, North America",https://www.takeprofit.com/,$1M to $10M,3000000,USD,3000000,Seed,1,2,,"397,917"
Seed Round - Ollie,https://www.crunchbase.com/funding_round/goodones-dcd7-seed--3d206d7a,Ollie,https://www.crunchbase.com/organization/goodones-dcd7,Seed,3500000,USD,3500000,2023-01-21,TLV Partners,"Liquid 2 Ventures, Peter Welinder, Rich Miner, TLV Partners",Seed,,,,Yes,GoodOnes is developing a mobile platforms.,"Apps, Digital Entertainment, Enterprise Software, Software",,"San Francisco, California, United States, North America",https://www.goodones.app,,3500000,USD,3500000,Seed,1,4,1,"402,181"
Seed Round - Proof of Impact,https://www.crunchbase.com/funding_round/proof-of-impact-seed--9170a7df,Proof of Impact,https://www.crunchbase.com/organization/proof-of-impact,Seed,6000000,USD,6000000,2022-08-02,Rakuten Capital,"Asiri, Blockchain Founders Capital, CV VC, FiveT Fintech (formerly Avaloq Ventures), Franklin Templeton, Oxford Angel Fund, Rakuten Capital, Working Capital Fund",Seed,,,,Yes,Proof of Impact is a data intelligence company that offers access to digital tools that collect and analyze ESG and Impact Data.,"Analytics, Big Data, Business Intelligence, Data Integration, Data Visualization, Information Technology, SaaS","Women Founded, Women Led","San Francisco, California, United States, North America",https://proof.io,$1M to $10M,8869985,USD,8869985,Seed,5,8,1,"204,796"
Seed Round - Vela,https://www.crunchbase.com/funding_round/vela-2-seed--e19b6ca3,Vela,https://www.crunchbase.com/organization/vela-2,Seed,,,,2022-07-01,,Hawke Ventures,Seed,,,,Yes,"Vela gives you the tools to manage, optimize and grow your business like never before","B2B, Business Intelligence, E-Commerce, Marketing",,"San Francisco, California, United States, North America",https://welcome.getvela.com,Less than $1M,,USD,,Seed,7,1,,"205,803"
Seed Round - Otto,https://www.crunchbase.com/funding_round/ottopetshq-seed--369db5b1,Otto,https://www.crunchbase.com/organization/ottopetshq,Seed,1600000,USD,1600000,2022-06-01,,,Seed,,,,Yes,Otto makes it easier to become a great pet owner by leveraging your pet’s data to connect you with personalized services and content.,"Information Technology, Internet of Things, Mobile Apps, Pet, QR Codes, Software",,"San Francisco, California, United States, North America",https://otto.pet,,1845000,USD,1845000,Seed,3,,,"206,938"
Seed Round - Akto,https://www.crunchbase.com/funding_round/akto-c09d-seed--c7604d6c,Akto,https://www.crunchbase.com/organization/akto-c09d,Seed,4500000,USD,4500000,2022-11-03,Accel,"Accel, Akshay Kothari, Milin Desai, Renaud Deraison",Seed,,,,Yes,"Akto is a platform for securing APIs and assists in quickly discovering APIs, running tests, and identifying business logic weaknesses.","Information Technology, Network Security, Software",,"San Francisco, California, United States, North America",https://www.akto.io,$1M to $10M,4500000,USD,4500000,Seed,2,4,1,"207,361"
Seed Round - Uno,https://www.crunchbase.com/funding_round/uno-4189-seed--9cb1f96c,Uno,https://www.crunchbase.com/organization/uno-4189,Seed,3000000,USD,3000000,2023-03-07,Andreessen Horowitz,"Andreessen Horowitz, Dug Song, Kevin Mahaffey",Seed,,,,Yes,Uno App is a collection of software tools (application) that helps people safeguard online security.,"Apps, Mobile Apps, Security",,"San Francisco, California, United States, North America",https://uno.app,,3000000,USD,3000000,M&A,1,3,,"280,988"
Seed Round - Boundary Layer Technologies,https://www.crunchbase.com/funding_round/boundary-layer-technologies-seed--fba247a3,Boundary Layer Technologies,https://www.crunchbase.com/organization/boundary-layer-technologies,Seed,4800000,USD,4800000,2022-06-01,,"Fifty Years, Lowercarbon Capital, Soma Capital",Seed,,,,Yes,Boundary Layer Technologies is a startup that builds high-speed container ships using hydrofoil technology.,"Marine Transportation, Transportation",,"San Francisco, California, United States, North America",http://boundarylayer.tech/,$1M to $10M,7100000,USD,7100000,Seed,3,3,,"282,379"
Seed Round - Sematic,https://www.crunchbase.com/funding_round/sematic-2bbe-seed--0a429da9,Sematic,https://www.crunchbase.com/organization/sematic-2bbe,Seed,3200000,USD,3200000,2022-11-17,Race Capital,"Brandon Leonardo, Fundament, Jeremy Stanley, Leonis Capital, Oliver Cameron, Pioneer Fund, Race Capital, Soma Capital, Y Combinator",Seed,,,,Yes,Sematic is an open-source orchestration platform for Machine Learning.,"Cloud Infrastructure, Developer Tools, Machine Learning, Open Source",,"San Francisco, California, United States, North America",https://www.sematic.dev/,,3200000,USD,3200000,Seed,1,9,1,"415,140"
Seed Round - Lightdash,https://www.crunchbase.com/funding_round/hubble-e65f-seed--fbf6ae6c,Lightdash,https://www.crunchbase.com/organization/hubble-e65f,Seed,8400000,USD,8400000,2022-10-06,Accel,"Accel, Ashley Kramer, David Cramer, Edward Bishop, Guillermo Rauch, Guy Podjarny, Lars Björk, Michel Tricot, Moonfire Ventures, Tim Sadler, Tristan Handy, Y Combinator",Seed,,,,Yes,Lightdash turns a dbt project into a full-stack BI platform.,"Analytics, Business Intelligence, Data Visualization, Open Source, SaaS, Software",,"San Francisco, California, United States, North America",https://www.lightdash.com,$1M to $10M,10800000,USD,10800000,Seed,3,12,2,"417,767"
Seed Round - Praan,https://www.crunchbase.com/funding_round/praan-seed--4bb6d2e8,Praan,https://www.crunchbase.com/organization/praan,Seed,,,,2022-07-01,,Uday Kumar Bangalore Shivaraman,Seed,,,,Yes,Praan is a deep tech company focused on particulate matter and CO2 capture using patent-pending technology.,"CleanTech, Hardware, Internet of Things, Renewable Energy",,"San Francisco, California, United States, North America",https://www.praan.io,$50M to $100M,1915500,USD,1915500,Seed,6,1,,"420,223"
Seed Round - Cumin Restaurant Group,https://www.crunchbase.com/funding_round/cumin-restaurant-group-seed--67441f7a,Cumin Restaurant Group,https://www.crunchbase.com/organization/cumin-restaurant-group,Seed,20000,USD,20000,2022-11-07,,Union Kitchen,Seed,,,,Yes,Namlo Foods offers momos.,"Food and Beverage, Food Processing, Snack Food",,"San Francisco, California, United States, North America",https://cuminrestaurantgro.wixsite.com/namlo-momo,,20000,USD,20000,Seed,1,1,,"127,177"
Seed Round - Cardinal,https://www.crunchbase.com/funding_round/cardinal-335d-seed--90230997,Cardinal,https://www.crunchbase.com/organization/cardinal-335d,Seed,4400000,USD,4400000,2022-07-25,Solana Ventures,"Alameda Research, CMS Holdings, Delphi Ventures, Solana Ventures",Seed,,,,Yes,"Cardinal is an NFT infrastructure protocol facilitator that offers leasing, staking, and ticketing to increase the utility of NFTs.","Blockchain, Cryptocurrency",,"San Francisco, California, United States, North America",https://www.cardinal.so/,,4400000,USD,4400000,Seed,1,4,,"127,957"
Seed Round - Stage,https://www.crunchbase.com/funding_round/stage-87b7-seed--addb4e15,Stage,https://www.crunchbase.com/organization/stage-87b7,Seed,5100000,USD,5100000,2022-06-07,Upfront Ventures,"BoxGroup, F-Prime Capital, HighSage Ventures, Jane Alexander, Jeff Weinstein, Joe Thomas, Kyle Parrish, Scott Belsky, Shreyas Doshi, Upfront Ventures, Vinay Hiremath, William Hockey",Seed,,,,Yes,The pricing and revenue optimization platform for SaaS,"SaaS, Software",,"San Francisco, California, United States, North America",https://www.heystage.com,,5100000,USD,5100000,Seed,1,12,2,"129,054"
Seed Round - Krunch,https://www.crunchbase.com/funding_round/krunch-ltd-seed--71b22fbc,Krunch,https://www.crunchbase.com/organization/krunch-ltd,Seed,275000,USD,275000,2022-07-01,"500 Global, Inspect Element","500 Global, Inspect Element",Seed,3000000,USD,3000000,Yes,Krunch helps developers drive more engagements to their Github repo.,Developer Tools,,"San Francisco, California, United States, North America",https://krunchdata.io,$1M to $10M,338867,USD,338867,Seed,2,2,,"130,289"
Seed Round - Bristle,https://www.crunchbase.com/funding_round/bristle-434a-seed--0ea72025,Bristle,https://www.crunchbase.com/organization/bristle-434a,Seed,3000000,USD,3000000,2022-07-25,Initialized Capital,"Anne Wojcicki, Initialized Capital, Y Combinator",Seed,,,,Yes,Bristle analyze saliva to monitor oral health and prevent disease from home.,"Dental, Health Care, Mobile Apps, Wellness",,"San Francisco, California, United States, North America",https://bristlehealth.com/,$1M to $10M,3000000,USD,3000000,Seed,3,3,1,"130,695"
Seed Round - Ansible Labs,https://www.crunchbase.com/funding_round/ansible-labs-seed--2ac497c4,Ansible Labs,https://www.crunchbase.com/organization/ansible-labs,Seed,7000000,USD,7000000,2022-08-10,Archetype,"A* Capital, Arca, Archetype, Castle Island Ventures, Eniac Ventures, Plural VC, Soma Capital",Seed,,,,Yes,Ansible Labs builds a payments platform for blockchain accounts.,"Cryptocurrency, FinTech, Payments, Web3",,"San Francisco, California, United States, North America",https://www.ansiblelabs.xyz,,7000000,USD,7000000,Seed,1,7,1,"131,246"
Seed Round - Universal Brain Inc.,https://www.crunchbase.com/funding_round/universal-brain-inc-seed--a389a8b6,Universal Brain Inc.,https://www.crunchbase.com/organization/universal-brain-inc,Seed,1500000,USD,1500000,2022-11-01,,,Seed,,,,Yes,"Universal Brain is developing personalized, non-invasive and at-home neuromodulation therapeutics to treat mental disorders.",Medical Device,,"San Francisco, California, United States, North America",https://universal-brain.com,,3450000,USD,3450000,Seed,4,,,"434,209"
Seed Round - Monnai,https://www.crunchbase.com/funding_round/monnai-seed--d6f8ade5,Monnai,https://www.crunchbase.com/organization/monnai,Seed,3150000,USD,3150000,2022-09-29,Better Tomorrow Ventures,"500 Global, 9Yards Capital, Better Tomorrow Ventures, Commerce Ventures, EMVC, Kearny Jackson",Seed,,,,Yes,Monnai is the global consumer insight infrastructure for fintech.,"Financial Services, FinTech, Identity Management, Infrastructure, Lending, Real Time",,"San Francisco, California, United States, North America",https://www.monnai.com,$1M to $10M,10650000,USD,10650000,Early Stage Venture,3,6,2,"421,631"
Seed Round - Coverself,https://www.crunchbase.com/funding_round/coverself-seed--9c4c1de1,Coverself,https://www.crunchbase.com/organization/coverself,Seed,4800000,USD,4800000,2022-09-14,"3one4 Capital, BEENEXT","3one4 Capital, BEENEXT",Seed,,,,Yes,Coverself develops a cloud-native platform to analyze and execute payment integrity programs.,"Cloud Data Services, FinTech, InsurTech, Payments",,"San Francisco, California, United States, North America",https://www.coverself.com,$1M to $10M,8200000,USD,8200000,Seed,2,2,1,"421,827"
Seed Round - Zing Data,https://www.crunchbase.com/funding_round/zing-data-seed--721aa616,Zing Data,https://www.crunchbase.com/organization/zing-data,Seed,2400000,USD,2400000,2022-06-29,"Correlation Ventures, Kindred Ventures","Correlation Ventures, Kindred Ventures",Seed,,,,Yes,"Mobile first, collaborative business intelligence for everyone","Analytics, Business Intelligence, Collaboration, Data Visualization, Mobile Apps, Productivity Tools, SaaS",,"San Francisco, California, United States, North America",https://getzingdata.com,,2400000,USD,2400000,Seed,1,2,1,"364,048"
Seed Round - OneSkin,https://www.crunchbase.com/funding_round/oneskin-seed--40a613ba,OneSkin,https://www.crunchbase.com/organization/oneskin,Seed,12412714,USD,12412714,2022-10-26,,"IndieBio, SOSV",Seed,,,,Yes,OneSkin is a longevity company developing products designed to extend skin and body health by targeting aging at its source.,"Beauty, Biotechnology, Cosmetics, Health Care, Wellness","Hispanic / Latine Founded, Women Founded, Women Led","San Francisco, California, United States, North America",https://www.oneskin.co/,$1M to $10M,19562714,USD,19562714,Seed,5,2,1,"364,955"
"Seed Round - Enhencer | AI Ads for Facebook, Google and Tiktok",https://www.crunchbase.com/funding_round/enhencer-seed--c327d6e9,"Enhencer | AI Ads for Facebook, Google and Tiktok",https://www.crunchbase.com/organization/enhencer,Seed,700000,USD,700000,2022-08-11,Diffusion Capital Partners,"Arzu Umur, Boğaziçi Ventures, Diffusion Capital Partners, Geometry Venture Development | Angel Investment Fund, Umut Şenol",Seed,,,,Yes,"SaaS, B2B Software, AI, Performance Marketing","Advertising Platforms, Artificial Intelligence (AI), Machine Learning, SaaS",,"San Francisco, California, United States, North America",https://enhencer.com,Less than $1M,890000,USD,890000,Seed,3,5,,"367,930"
Seed Round - Tazi,https://www.crunchbase.com/funding_round/tazi-io-seed--53337c9a,Tazi,https://www.crunchbase.com/organization/tazi-io,Seed,4600000,USD,4600000,2022-08-18,Illuminate Ventures,"Diffusion Capital Partners, Foothill Ventures, Handshake Ventures, Illuminate Ventures",Seed,,,,Yes,Tazi is a software development company that provides adaptive machine-learning services.,"Artificial Intelligence (AI), Computer, InsurTech, Machine Learning, Software","Women Founded, Women Led","San Francisco, California, United States, North America",http://tazi.ai,$1M to $10M,6289300,USD,6289300,Seed,4,4,,"367,975"
Seed Round - Twelve Labs,https://www.crunchbase.com/funding_round/twelve-labs-62b5-seed--7a477ad0,Twelve Labs,https://www.crunchbase.com/organization/twelve-labs-62b5,Seed,12000000,USD,12000000,2022-12-05,Radical Ventures,"Index Ventures, Jay Simons, Jonathan Rosenbluth, Kyle Parrish, Lukas Biewald, Nicolas Dessaigne, Oliver Cameron, Radical Ventures, Spring Ventures, WndrCo",Seed,,,,Yes,Twelve Labs is making video foundation models accessible via APIs to empower businesses and developers to build intelligent video products.,"Generative AI, Information Technology, Software, Video",,"San Francisco, California, United States, North America",http://twelvelabs.io/,$1M to $10M,27120000,USD,27120000,Seed,4,10,2,"368,228"
Seed Round - Blossom.team,https://www.crunchbase.com/funding_round/blossom-team-seed--b809e81e,Blossom.team,https://www.crunchbase.com/organization/blossom-team,Seed,1500000,USD,1500000,2022-08-26,Kevin Carter,"Brian Pokorny, Caffeinated Capital, Gold House Ventures, Kevin Carter, Niche Capital",Seed,,,,Yes,"Science-backed, analytics-driven coaching for professionals","Analytics, Business Development, Software",,"San Francisco, California, United States, North America",https://blossom.team/,$1M to $10M,1500000,USD,1500000,Seed,1,5,,"368,911"
Seed Round - Flourish Labs,https://www.crunchbase.com/funding_round/flourish-labs-seed--d049f204,Flourish Labs,https://www.crunchbase.com/organization/flourish-labs,Seed,100000,USD,100000,2023-02-28,One Mind Accelerator,One Mind Accelerator,Seed,,,,Yes,Flourish Labs combines mental health science and technology to mobilize professional peer support to address the mental health crisis.,"Health Care, Information Technology, Medical, Mental Health",,"San Francisco, California, United States, North America",https://flourishlabs.com,$10M to $50M,6469899,USD,6469899,Seed,2,1,2,"369,030"
Seed Round - Cass AI,https://www.crunchbase.com/funding_round/cass-ai-seed--4e44ea4d,Cass AI,https://www.crunchbase.com/organization/cass-ai,Seed,4600000,USD,4600000,2022-10-07,PivotNorth Capital,PivotNorth Capital,Seed,23000000,USD,23000000,Yes,Vertical generative AI coaching chat SaaS startup: made ChatGPT safe for our 39 enterprise customers.,"Artificial Intelligence (AI), Generative AI, Health Care, Marketing Automation, Natural Language Processing",,"San Francisco, California, United States, North America",https://cass.ai,$1M to $10M,4600000,USD,4600000,Seed,1,1,1,"245,452"
Seed Round - Revolving Games,https://www.crunchbase.com/funding_round/revolving-games-inc-seed--53455cab,Revolving Games,https://www.crunchbase.com/organization/revolving-games-inc,Seed,13200000,USD,13200000,2022-09-09,Pantera Capital,"Dan Houser, Dapper Labs, DWeb3 Capital, Kenetic, Pantera Capital, Permanens Capital, Polygon, Sarmayacar",Seed,,,,Yes,Revolving Games is a mobile game studio that creates and delivers Web3 experiences for gamers.,"Blockchain, Gamification, Gaming, MMO Games, PC Games, Web3",,"San Francisco, California, United States, North America",http://revolvinggames.com,$10M to $50M,25200000,USD,25200000,,4,8,1,"246,922"
Seed Round - The Easy Company,https://www.crunchbase.com/funding_round/the-easy-company-seed--c41f3559,The Easy Company,https://www.crunchbase.com/organization/the-easy-company,Seed,14200000,USD,14200000,2023-01-10,lobby capital,"6th Man Ventures, lobby capital, Relay Ventures, Scribble Ventures, Tapestry VC, Upside Partnership",Seed,,,,Yes,The Easy Company is working to improve Web3's usability and security.,"Blockchain, Software, Web3",,"San Francisco, California, United States, North America",https://easy.me,$1M to $10M,14200000,USD,14200000,Seed,1,6,2,"215,481"
Seed Round - Crescendo Health,https://www.crunchbase.com/funding_round/crescendo-health-seed--fa0f4c45,Crescendo Health,https://www.crunchbase.com/organization/crescendo-health,Seed,3400000,USD,3400000,2023-01-05,Define Ventures,Define Ventures,Seed,,,,Yes,Crescendo Health's mission is to accelerate clinical trials and medical innovation,"Clinical Trials, Health Care, Medical",,"San Francisco, California, United States, North America",https://crescendo.health,$1M to $10M,3400000,USD,3400000,Seed,1,1,1,"216,671"
Seed Round - ASENSEI,https://www.crunchbase.com/funding_round/asensei-seed--c7c10d66,ASENSEI,https://www.crunchbase.com/organization/asensei,Seed,,,,2022-07-20,SeventySix Capital,SeventySix Capital,Seed,,,,Yes,The easiest way to add technique coaching and correction to sport and fitness products.,"Fitness, Health Care, Personal Health, Wellness",,"San Francisco, California, United States, North America",http://www.asensei.ai,Less than $1M,6050494,USD,6050494,Seed,3,1,1,"512,640"
Seed Round - Webacy,https://www.crunchbase.com/funding_round/webacy-seed--b1d2caf3,Webacy,https://www.crunchbase.com/organization/webacy,Seed,4000000,USD,4000000,2023-02-07,Gmjp,"AJ Vaynerchuk, DG Daiwa Ventures, Dreamers VC, Gary Vaynerchuk, Gmjp, MIRAISE, Mozilla, Quantstamp, Soma Capital",Seed,,,,Yes,Secure Your Digital Assets for the Unexpected,"Bitcoin, Blockchain, Cryptocurrency, Software",,"San Francisco, California, United States, North America",https://www.webacy.co/,$1M to $10M,5000000,USD,5000000,Seed,2,9,1,"513,040"
Seed Round - Resourcely,https://www.crunchbase.com/funding_round/resourcely-seed--3b58b91e,Resourcely,https://www.crunchbase.com/organization/resourcely,Seed,8300000,USD,8300000,2022-07-26,"Andreessen Horowitz, Felicis","Adam Cotenoff, Adam Gross, Andreessen Horowitz, Anna Westelius, Bryant Zadegan, Caleb Sima, Charles Zedlewski, Chris Post, Christian Almenar, Clint Gibler, David King, David Rook, Debosmit Ray, Dylan Ayrey, Ely Kahn, Eynat Guez, Farooq Abbasi, Felicis, Gordon Chaffee, Harshil Parikh, Jake Guerre, Jason Chan, Jason S. Martin, Jen Yip, Jesse Kriss, Joseph Abebe, Josh Snyder, Julia Knecht, Leif Dreizler, Leticia Lourenco, Mark Hillick, Michael Coates, Mike Haydon, Mike Ruth, Nkechi Iregbulem, Patrick Thomas, Paul Nguyen, Rob Fletcher, Rob Witoff, Ryan McGeehan, Ryland Goldstein, Scott Behrens, Seth Vargo, Spencer Kimball, Srinath Kuruvadi, Talha Tariq, Tim Chen, Tom Alcock, Varun Badhwar, William Bengtson",Seed,,,,Yes,Resourcely lets you provision resource templates that are secure and compliant by design.,"Compliance, Security, Software",,"San Francisco, California, United States, North America",https://www.resourcely.io/,$1M to $10M,8300000,USD,8300000,Seed,1,50,1,"514,216"
Seed Round - Caldo Restaurant Technologies,https://www.crunchbase.com/funding_round/caldo-restaurant-technologies-seed--c7e1d77c,Caldo Restaurant Technologies,https://www.crunchbase.com/organization/caldo-restaurant-technologies,Seed,,,,2022-07-19,SOSV,"HAX, SOSV",Seed,,,,Yes,Caldo Restaurant Technologies is a robotics company that provides kitchen automation technology.,"Catering, Electronics, Restaurants, Robotics",,"San Francisco, California, United States, North America",https://caldo.io,$1M to $10M,,USD,,Seed,2,2,1,"515,804"
Seed Round - Complete,https://www.crunchbase.com/funding_round/complete-32d7-seed--b16a5a4a,Complete,https://www.crunchbase.com/organization/complete-32d7,Seed,4000000,USD,4000000,2022-08-22,Accel,"Accel, Calm, Stripe, Y Combinator",Seed,,,,Yes,"Create, collaborate on, and explain compensation practices from day zero.","Data Integration, Developer Platform, Enterprise Software",,"San Francisco, California, United States, North America",https://www.complete.so/,,4125000,USD,4125000,Seed,2,4,1,"535,393"
Seed Round - Heylo,https://www.crunchbase.com/funding_round/heylo-a6ce-seed--09035401,Heylo,https://www.crunchbase.com/organization/heylo-a6ce,Seed,1500000,USD,1500000,2022-11-01,"Precursor Ventures, Worklife Ventures","Precursor Ventures, Worklife Ventures",Seed,,,,Yes,Heylo is the community management platform for in-person groups.,"Information Technology, Social, Software",,"San Francisco, California, United States, North America",https://www.heylo.co/,,1500000,USD,1500000,Seed,1,2,2,"342,973"
Seed Round - Shape,https://www.crunchbase.com/funding_round/shapescale-seed--eac2baab,Shape,https://www.crunchbase.com/organization/shapescale,Seed,,,,2022-09-01,,Rebel Fund,Seed,,,,Yes,ShapeScale combines computer vision and 3D into a new form of measuring health and fitness.,"3D Technology, Artificial Intelligence (AI), Computer Vision, Fitness, Health Care, Health Diagnostics, Machine Learning, Personal Health, Quantified Self, Wellness",,"San Francisco, California, United States, North America",https://shapescale.com/,$1M to $10M,4721889,USD,4721889,Seed,4,1,,"316,481"
Seed Round - QuarkXR,https://www.crunchbase.com/funding_round/quarkxr-seed--a33b617e,QuarkXR,https://www.crunchbase.com/organization/quarkxr,Seed,725000,EUR,755706,2022-11-30,,Vitosha Venture Partners,Seed,,,,Yes,QuarkXR is a deep tech company building out the XR  Cloud Platform for 5G and Edge Computing.,"Apps, Augmented Reality, Cloud Computing, Cloud Infrastructure, Software, Virtual Reality",,"San Francisco, California, United States, North America",http://www.quarkxr.com,$1M to $10M,1731447,USD,1731447,Seed,5,1,,"316,729"
Seed Round - UptimeAI,https://www.crunchbase.com/funding_round/uptimeai-seed--2315de55,UptimeAI,https://www.crunchbase.com/organization/uptimeai,Seed,3500000,USD,3500000,2022-12-15,Emergent Ventures,"AISprouts, Emergent Ventures, Sharad Sanghi, Venture Catalysts, YourNest Venture Capital",Seed,,,,Yes,UptimeAI specializes in AI-based predictive maintenance software for heavy industries.,"Artificial Intelligence (AI), Industrial, Machine Learning, Software",,"San Francisco, California, United States, North America",https://www.uptimeai.com/,Less than $1M,5006792,USD,5006792,Seed,4,5,2,"318,893"
Seed Round - ToolJet,https://www.crunchbase.com/funding_round/tooljet-seed--08e37dbc,ToolJet,https://www.crunchbase.com/organization/tooljet,Seed,4600000,USD,4600000,2023-01-12,Nexus Venture Partners,"Better Capital, January Capital, Nexus Venture Partners, Nicolas Dessaigne, Ratio Ventures",Seed,,,,Yes,ToolJet is a low-code open-source platform for developing and deploying custom business applications.,"Developer APIs, Developer Tools, Enterprise Software, Open Source",,"San Francisco, California, United States, North America",https://tooljet.com,$1M to $10M,6154997,USD,6154997,,3,5,2,"318,920"
Seed Round - HumanQ,https://www.crunchbase.com/funding_round/humanq-seed--3a734dc7,HumanQ,https://www.crunchbase.com/organization/humanq,Seed,2000000,USD,2000000,2022-08-31,Kindred Ventures,"Dinesh Chahlia, Elena Gomez, Kindred Ventures, Lisa Paul",Seed,,,,Yes,HumanQ offers executive level skills at every level of the organization for accelerated growth and impact through intimate group coaching.,"Consulting, Corporate Training, Professional Services, Training","Women Founded, Women Led","San Francisco, California, United States, North America",https://humanq.com/,$1M to $10M,3500000,USD,3500000,Seed,2,4,,"235,825"
