Seed Round - HyperArc,https://www.crunchbase.com/funding_round/hyperarc-seed--42f61ed5,HyperArc,https://www.crunchbase.com/organization/hyperarc,Seed,5000000,USD,5000000,2022-08-08,,"Firsthand Alliance, Mango Capital, Orange DAO",Seed,,,,Yes,HyperArc is a data platform for Web3 providing analytics.,"Analytics, Blockchain, Software, Web3",,"San Francisco, California, United States, North America",https://www.hyperarc.com,$1M to $10M,5000000,USD,5000000,Seed,1,3,1,"53,183"
Seed Round - Tumble,https://www.crunchbase.com/funding_round/tumble-seed--2b721e80,Tumble,https://www.crunchbase.com/organization/tumble,Seed,7000000,USD,7000000,2022-10-05,Hivers and Strivers,"Array Ventures, Atacama Ventures, Hivers and Strivers, Rich Heise, Richard Dalzell, The PenFed Foundation, Western Technology Investment, Zag Capital",Seed,,,,Yes,Tumble is a smart laundry technology platform transforming shared laundry rooms into high-quality smart amenities.,"Internet of Things, Laundry and Dry-cleaning, Mobile, Software",,"San Francisco, California, United States, North America",https://tumble.to,$1M to $10M,8750500,USD,8750500,Seed,3,8,1,"53,234"
Seed Round - Deciduous Therapeutics,https://www.crunchbase.com/funding_round/deciduous-therapeutics-seed--c7f36aed,Deciduous Therapeutics,https://www.crunchbase.com/organization/deciduous-therapeutics,Seed,10000000,USD,10000000,2022-12-31,,"Bold Capital Partners, Healthspan Capital, Humboldt Fund, Owl Capital",Seed,,,,Yes,Deciduous Therapeutics is an aging therapeutics company developing a novel class of immune modulatory therapies.,"Biopharma, Biotechnology, Health Care",,"San Francisco, California, United States, North America",https://www.deciduoustx.com/,$1M to $10M,16500000,USD,16500000,Seed,3,4,,"53,184"
Seed Round - AssetMule,https://www.crunchbase.com/funding_round/assetmule-seed--35a769ca,AssetMule,https://www.crunchbase.com/organization/assetmule,Seed,150000,USD,150000,2023-11-02,,,Seed,,,,Yes,AssetMule is a sales asset generation platform that allows users to create sales assets and custom templates.,"Information Technology, Marketing, Online Portals, Sales, Software",,"San Francisco, California, United States, North America",https://assetmule.ai,,150000,USD,150000,Seed,1,,,"53,159"
Seed Round - InTone,https://www.crunchbase.com/funding_round/intone-seed--18cbdf30,InTone,https://www.crunchbase.com/organization/intone,Seed,1700000,USD,1700000,2023-05-11,,"A.Partners, Ilya Sedoshkin, Yellow Rocks!",Seed,,,,Yes,InTone facilitates international communication by doing real-time accent enhancement,"Artificial Intelligence (AI), Enterprise Software, Machine Learning, Natural Language Processing, Software",,"San Francisco, California, United States, North America",https://www.intone.io/,$1M to $10M,1700000,USD,1700000,Seed,2,3,1,"53,413"
Seed Round - Senzo,https://www.crunchbase.com/funding_round/senzo-seed--29d6952a,Senzo,https://www.crunchbase.com/organization/senzo,Seed,1900000,USD,1900000,2022-12-12,"BioAdvance, Wellness Coaches USA","Abenteuer Ventures, BioAdvance, Wellness Coaches USA",Seed,,,,Yes,Senzo is a deep-tech bio-med company developing testing products and IP.,"Biotechnology, Health Care, Health Diagnostics, Information Technology",,"San Francisco, California, United States, North America",https://www.senzo.com/,Less than $1M,5700000,USD,5700000,,9,3,2,"53,894"
Seed Round - Connectly.ai,https://www.crunchbase.com/funding_round/connectly-seed--5e8bb2df,Connectly.ai,https://www.crunchbase.com/organization/connectly,Seed,2500000,USD,2500000,2023-03-30,Unusual Ventures,Unusual Ventures,Seed,,,,Yes,Connectly is the leader in conversational AI. Connectly’s platform automates how businesses communicate with their customers,"Information Technology, Internet, Machine Learning, Messaging",,"San Francisco, California, United States, North America",https://www.connectly.ai,$1M to $10M,17250000,USD,17250000,Early Stage Venture,4,1,,"54,274"
Seed Round - Numeral,https://www.crunchbase.com/funding_round/numeral-72d0-seed--d7286bea,Numeral,https://www.crunchbase.com/organization/numeral-72d0,Seed,,,,2023-05-01,,Codie Sanchez,Seed,,,,Yes,Numeral automates all aspects of sales tax which simplifies the sales tax process.,"FinTech, Information Technology, Software",,"San Francisco, California, United States, North America",https://www.numeralhq.com,,500000,USD,500000,Seed,2,1,,"54,593"
Seed Round - Finta,https://www.crunchbase.com/funding_round/porter-446a-seed--db94b5ec,Finta,https://www.crunchbase.com/organization/porter-446a,Seed,2000000,USD,2000000,2023-04-01,,"FoundersX Ventures, Garage Capital, Immad Akhund, Stonks, Underdog Labs, UpHonest Capital, Y Combinator, Zeno Partners",Seed,,,,Yes,"Finta is the simplest way for startups to manage taxes, bookkeeping, and track financial metrics - all in one platform.","Accounting, Finance, Financial Services, SaaS, Software",,"San Francisco, California, United States, North America",https://www.finta.com,,2125000,USD,2125000,Seed,3,8,,"54,670"
Seed Round - Price.com,https://www.crunchbase.com/funding_round/price-technologies-seed--d4f22d9c,Price.com,https://www.crunchbase.com/organization/price-technologies,Seed,4000000,USD,4000000,2023-01-03,The London Fund,The London Fund,Seed,,,,Yes,"Price.com develops a money savings platform used for comparison shopping, cashback, coupons, price history, and price alerts.","Artificial Intelligence (AI), Big Data, E-Commerce, Shopping, Software",,"San Francisco, California, United States, North America",https://price.com,Less than $1M,19500000,USD,19500000,Seed,6,1,,"54,727"
Seed Round - Chroma,https://www.crunchbase.com/funding_round/chroma-4a75-seed--8f267b62,Chroma,https://www.crunchbase.com/organization/chroma-4a75,Seed,18000000,USD,18000000,2023-04-06,Quiet Capital,"Akshay Kothari, Amjad Masad, Guillermo Rauch, Jack Altman, Jordan Tigani, Max Altman, Naval Ravikant, Quiet Capital, Spencer Kimball",Seed,57000000,USD,57000000,Yes,Chroma operates as an AI-native open-source embedding database.,"Artificial Intelligence (AI), Database, Software",,"San Francisco, California, United States, North America",https://www.trychroma.com/,,20300000,USD,20300000,Seed,2,9,,"54,876"
Seed Round - Softudio Technology,https://www.crunchbase.com/funding_round/softudio-technology-seed--873ddc20,Softudio Technology,https://www.crunchbase.com/organization/softudio-technology,Seed,2500000,USD,2500000,2023-03-28,Moses Shimon,Moses Shimon,Seed,,,,Yes,"SAAS, Mobile App, Consulting",Software,,"San Francisco, California, United States, North America",https://www.softudios.com,,2500000,USD,2500000,Seed,1,1,,"54,874"
Seed Round - Sol,https://www.crunchbase.com/funding_round/sol-8be5-seed--278dd775,Sol,https://www.crunchbase.com/organization/sol-8be5,Seed,5000000,USD,5000000,2023-06-09,Garry Tan,Garry Tan,Seed,,,,Yes,Sol is the creator of the Sol Reader VR headset aimed at providing users distraction free reading,"Edutainment, Information Technology, Reading Apps, Virtual Reality",,"San Francisco, California, United States, North America",https://solreader.com,,5000000,USD,5000000,Seed,1,1,,"54,918"
Seed Round - MiddlewareHQ,https://www.crunchbase.com/funding_round/middleware-60fd-seed--b6701d77,MiddlewareHQ,https://www.crunchbase.com/organization/middleware-60fd,Seed,500000,USD,500000,2023-10-25,,,Seed,,,,Yes,Middleware is a B2B SaaS platform for engineering leadership to make it more productive.,"Information Technology, Productivity Tools, SaaS, Software Engineering",,"San Francisco, California, United States, North America",https://www.middlewarehq.com/,,500000,USD,500000,Seed,1,,,"55,060"
Seed Round - Compiify,https://www.crunchbase.com/funding_round/compiify-seed--fba8c1a2,Compiify,https://www.crunchbase.com/organization/compiify,Seed,3900000,USD,3900000,2023-10-24,,,Seed,,,,Yes,"Compiify enables businesses to decide on pay in a fair, competitive, and effective manner.","Billing, Data Center Automation, Employee Benefits",,"San Francisco, California, United States, North America",https://compiify.com/owner,,4900000,USD,4900000,Seed,2,,,"55,512"
Seed Round - Addy,https://www.crunchbase.com/funding_round/addy-2544-seed--c50bff35,Addy,https://www.crunchbase.com/organization/addy-2544,Seed,,,,2023-06-14,VentureBridge Program,VentureBridge Program,Seed,,,,Yes,Addy is an AI-powered platform that enables businesses to link their data and train proprietary Large Language Models.,Software,,"San Francisco, California, United States, North America",https://addy-ai.com,,,USD,,Seed,1,1,,"55,778"
Seed Round - Forsight,https://www.crunchbase.com/funding_round/forsight-seed--273db802,Forsight,https://www.crunchbase.com/organization/forsight,Seed,,,,2023-09-13,,Roman Smolevskiy,Seed,,,,Yes,Forsight is an Ai software solution for construction safety and security.,"Artificial Intelligence (AI), Information Technology, Machine Learning, Security, Software",,"San Francisco, California, United States, North America",https://forsight.ai,$1M to $10M,,USD,,Seed,2,1,,"55,899"
Seed Round - Tangible,https://www.crunchbase.com/funding_round/tangible-d113-seed--cea2da0e,Tangible,https://www.crunchbase.com/organization/tangible-d113,Seed,,,,2022-12-27,,Roman Smolevskiy,Seed,,,,Yes,Tangible is a climate technology company focused on sustainable materials and embodied carbon management for real estate developers.,"Construction, Information Technology, Software","Women Founded, Women Led","San Francisco, California, United States, North America",https://tangiblematerials.com/,,3000000,USD,3000000,Seed,3,1,,"55,949"
Seed Round - Stitch Financial,https://www.crunchbase.com/funding_round/stitch-financial-seed--d37b3a1c,Stitch Financial,https://www.crunchbase.com/organization/stitch-financial,Seed,2854995,USD,2854995,2023-10-19,,,Seed,,,,Yes,Stitch Financial is a technology company.,"Financial Services, Information Technology, Software",,"San Francisco, California, United States, North America",,,2854995,USD,2854995,Seed,1,,,"56,060"
Seed Round - NeuralScripter,https://www.crunchbase.com/funding_round/neuralscripter-seed--9cdcd094,NeuralScripter,https://www.crunchbase.com/organization/neuralscripter,Seed,5000000,USD,5000000,2023-03-06,8VC,8VC,Seed,,,,Yes,Unlock Your Code's Potential with NeuralScripter: Harnessing the Power of AI for Intelligent Testing!,"Apps, Database, Developer APIs",,"San Francisco, California, United States, North America",https://neuralscripter.com/,,5000000,USD,5000000,Seed,1,1,,"56,108"
Seed Round - Docsum,https://www.crunchbase.com/funding_round/docsum-seed--e01754c3,Docsum,https://www.crunchbase.com/organization/docsum,Seed,,,,2023-10-01,,Sunstone Management,Seed,,,,Yes,Developer of an AI-based platform designed to support the sales team of a business.,"Artificial Intelligence (AI), Document Preparation, Software",,"San Francisco, California, United States, North America",https://www.docsum.ai/,,,USD,,Seed,1,1,,"56,266"
Seed Round - Pangeam Inc.,https://www.crunchbase.com/funding_round/pangeam-seed--fc72ab30,Pangeam Inc.,https://www.crunchbase.com/organization/pangeam,Seed,1500000,USD,1500000,2022-12-01,SNR.vc,"Niremia Collective, SNR.vc",Seed,18000000,USD,18000000,Yes,Pangeam is a human analytics platform powered by deep learning sensors.,"Commercial Real Estate, Enterprise Software, SaaS, Sensor, Test and Measurement",,"San Francisco, California, United States, North America",https://www.pangeam.com,$1M to $10M,2750000,USD,2750000,Seed,3,2,2,"56,473"
Seed Round - bubl,https://www.crunchbase.com/funding_round/bubl-3316-seed--ae790044,bubl,https://www.crunchbase.com/organization/bubl-3316,Seed,300000,USD,300000,2023-10-18,,,Seed,,,,Yes,The soundproof workspace designed to improve focus.,"Architecture, Artificial Intelligence (AI), Commercial Real Estate, Computer Vision, Construction, Hardware, Interior Design, Internet of Things, Smart Building, Software",,"San Francisco, California, United States, North America",https://www.bubl.space,,300000,USD,300000,Seed,1,,,"56,391"
Seed Round - Pangeam Inc.,https://www.crunchbase.com/funding_round/pangeam-seed--f3524274,Pangeam Inc.,https://www.crunchbase.com/organization/pangeam,Seed,,,,2022-11-01,,"Niremia Collective, SNR.vc",Seed,,,,Yes,Pangeam is a human analytics platform powered by deep learning sensors.,"Commercial Real Estate, Enterprise Software, SaaS, Sensor, Test and Measurement",,"San Francisco, California, United States, North America",https://www.pangeam.com,$1M to $10M,2750000,USD,2750000,Seed,3,2,,"56,339"
Seed Round - PointsHound,https://www.crunchbase.com/funding_round/pointshound-seed--58b2c889,PointsHound,https://www.crunchbase.com/organization/pointshound,Seed,,,,2023-09-01,,Sunstone Management,Seed,,,,Yes,PointsHound is an online travel agency providing individuals with frequent flyer miles and loyalty rewards for hotel bookings.,"Hospitality, Hotel, Travel",,"San Francisco, California, United States, North America",http://www.pointshound.com,$1M to $10M,425000,USD,425000,Seed,2,1,,"56,255"
Seed Round - Wyvern AI,https://www.crunchbase.com/funding_round/wyvern-ai-seed--b67bfd32,Wyvern AI,https://www.crunchbase.com/organization/wyvern-ai,Seed,,,,2023-10-01,,Sunstone Management,Seed,,,,Yes,Wyvern AI is a provider of a machine learning platform for marketplaces to optimize product ranking.,"Artificial Intelligence (AI), Developer APIs, Information Technology, Machine Learning",,"San Francisco, California, United States, North America",https://www.wyvern.ai/,,,USD,,Seed,1,1,,"56,484"
Seed Round - Rephrase.ai,https://www.crunchbase.com/funding_round/rephrase-ai-seed--126d8d70,Rephrase.ai,https://www.crunchbase.com/organization/rephrase-ai,Seed,,,,2023-06-27,Comcast NBCUniversal LIFT Labs,Comcast NBCUniversal LIFT Labs,Seed,,,,Yes,Rephrase builds generative AI tools to create professional videos with the ease of writing text.,"Animation, Artificial Intelligence (AI), Augmented Reality, Generative AI, Video, Virtual Reality",,"San Francisco, California, United States, North America",https://rephrase.ai/,$1M to $10M,12200000,USD,12200000,M&A,4,1,,"56,689"
Seed Round - Monterey AI,https://www.crunchbase.com/funding_round/monterey-ai-seed--a68b5267,Monterey AI,https://www.crunchbase.com/organization/monterey-ai,Seed,,,,2023-06-27,Comcast NBCUniversal LIFT Labs,Comcast NBCUniversal LIFT Labs,Seed,,,,Yes,Monterey AI is a product development copilot that helps clients collect feedback and drive insights.,"Artificial Intelligence (AI), Productivity Tools, SaaS",,"San Francisco, California, United States, North America",http://www.monterey.ai,,,USD,,Seed,2,1,,"56,902"
Seed Round - Activepieces,https://www.crunchbase.com/funding_round/activepieces-seed--c49c3ac2,Activepieces,https://www.crunchbase.com/organization/activepieces,Seed,1550000,USD,1550000,2023-03-01,,Y Combinator,Seed,,,,Yes,Activepieces is an open source business automation software that allows users to automate their work without writing code.,"Embedded Software, Marketing Automation, Open Source, Software",,"San Francisco, California, United States, North America",https://www.activepieces.com,,1550000,USD,1550000,Seed,2,1,,"57,046"
Seed Round - Airhart Aeronautics,https://www.crunchbase.com/funding_round/airhart-aeronautics-seed--23254049,Airhart Aeronautics,https://www.crunchbase.com/organization/airhart-aeronautics,Seed,,,,2022-09-08,,"Pioneer Fund, Unpopular Ventures, Y Combinator",Seed,,,,Yes,Airhart Aeronautics creates semi-autonomous airplanes that make it easier for pilots to operate their own planes.,"Aerospace, Autonomous Vehicles, Manufacturing",,"San Francisco, California, United States, North America",https://www.airhartaero.com,,,USD,,Seed,1,3,,"57,423"
Seed Round - PropTexx,https://www.crunchbase.com/funding_round/proptexx-seed--e9bedef2,PropTexx,https://www.crunchbase.com/organization/proptexx,Seed,,,,2023-04-05,,Techstars,Seed,,,,Yes,"PropTexx supports the Real Estate sector with innovative computer vision, immersive generative AI, and real-time BI solutions.","Artificial Intelligence (AI), Computer Vision, Machine Learning, Natural Language Processing, PropTech, Real Estate, Software",,"San Francisco, California, United States, North America",https://proptexx.com,Less than $1M,625000,USD,625000,Seed,6,1,,"58,249"
Seed Round - Level Health,https://www.crunchbase.com/funding_round/level-health-17ec-seed--04aae113,Level Health,https://www.crunchbase.com/organization/level-health-17ec,Seed,4000000,USD,4000000,2023-10-06,,,Seed,,,,Yes,Level Health develops modern financial tools for health care provider organizations.,"Financial Services, Health Care, Software",,"San Francisco, California, United States, North America",https://www.level.health/,,4000000,USD,4000000,Seed,1,,,"58,707"
Seed Round - Outerbase,https://www.crunchbase.com/funding_round/outerbase-seed--5bd5c7ac,Outerbase,https://www.crunchbase.com/organization/outerbase,Seed,,,,2023-04-24,,TRAC,Seed,,,,Yes,"Outerbase is an interface to view, edit, and modify data and generate visual dashboards without having to write a single line of SQL.","Data Visualization, Database, Software",,"San Francisco, California, United States, North America",https://www.outerbase.com,,500000,USD,500000,Seed,3,1,,"59,197"
Seed Round - Century House Partners,https://www.crunchbase.com/funding_round/century-house-partners-seed--73c6c314,Century House Partners,https://www.crunchbase.com/organization/century-house-partners,Seed,600000,USD,600000,2023-10-02,,,Seed,,,,Yes,"Century House Partners is an investment firm that finds, acquires, and operates high-quality businesses for a long term.","Finance, Financial Services, Hedge Funds, Venture Capital",,"San Francisco, California, United States, North America",https://www.centuryhousepartners.com/,,600000,USD,600000,Seed,1,,,"59,379"
Seed Round - Etched.ai,https://www.crunchbase.com/funding_round/etched-ai-seed--884b1466,Etched.ai,https://www.crunchbase.com/organization/etched-ai,Seed,5360000,USD,5360000,2023-05-16,Primary Venture Partners,"Devin Wenig, Michael Kohen, Primary Venture Partners",Seed,,,,Yes,Etched.ai designing specialized chips for language model inference.,"Computer, Hardware",,"San Francisco, California, United States, North America",https://etched.ai,,5360000,USD,5360000,Seed,1,3,1,"59,652"
Seed Round - Graft,https://www.crunchbase.com/funding_round/graft-13a7-seed--67172a02,Graft,https://www.crunchbase.com/organization/graft-13a7,Seed,10000000,USD,10000000,2023-03-14,Radical Ventures,"Google Ventures, Radical Ventures",Seed,,,,Yes,Our Modern AI platform enables anyone to build production-ready AI apps in a few clicks.,"Artificial Intelligence (AI), Machine Learning, Natural Language Processing",,"San Francisco, California, United States, North America",https://www.graft.com,$1M to $10M,14500000,USD,14500000,Seed,2,2,,"60,072"
Seed Round - AuditMate,https://www.crunchbase.com/funding_round/auditmate-seed--c65828a9,AuditMate,https://www.crunchbase.com/organization/auditmate,Seed,,,,2023-04-10,,Moderne Ventures,Seed,,,,Yes,First-ever SaaS to get more from your elevator maintenance contract,"Consulting, SaaS, Software",,"San Francisco, California, United States, North America",http://www.auditmate.com,,,USD,,Seed,2,1,,"60,165"
Seed Round - Holdingz,https://www.crunchbase.com/funding_round/holdingz-seed--1cc00e5e,Holdingz,https://www.crunchbase.com/organization/holdingz,Seed,4000000,USD,4000000,2022-07-01,,"Album VC, Fin Capital",Seed,,,,Yes,"Holdingz is a risk management platform that helps businesses diversify, protect, and grow their holdings.","Consulting, Finance, Risk Management",,"San Francisco, California, United States, North America",https://www.holdings.io,,7000000,USD,7000000,Seed,2,2,,"60,840"
Seed Round - Fermat Commerce,https://www.crunchbase.com/funding_round/fermat-commerce-seed--2e47113a,Fermat Commerce,https://www.crunchbase.com/organization/fermat-commerce,Seed,12000000,USD,12000000,2022-09-19,,"Courtside Ventures, Edward Lando, Greylock, Kaushik Subramanian, Nadav Ben-Chanoch, Pareto Holdings, QED Investors",Seed,,,,Yes,Fermat Commerce develops an influencer-driven e-commerce platform.,"E-Commerce, Shopping, Social Media Marketing",,"San Francisco, California, United States, North America",https://fermatcommerce.com,$10M to $50M,12000000,USD,12000000,Seed,1,7,2,"60,944"
Seed Round - Neatleaf,https://www.crunchbase.com/funding_round/neatleaf-seed--f99e36b4,Neatleaf,https://www.crunchbase.com/organization/neatleaf,Seed,5500000,USD,5500000,2023-01-01,Measure 8 Venture Partners,"Lightbank, Measure 8 Venture Partners, Vsquared Ventures",Seed,,,,Yes,Data-driven & autonomous agriculture for yield optimization.,"Agriculture, Artificial Intelligence (AI), Cloud Computing, Computer Vision, Robotics, Sensor",,"San Francisco, California, United States, North America",https://neatleaf.com,$1M to $10M,12000000,USD,12000000,Seed,3,3,,"61,040"
Seed Round - NeuroTrainer,https://www.crunchbase.com/funding_round/neurotrainer-seed--b14d9ad6,NeuroTrainer,https://www.crunchbase.com/organization/neurotrainer,Seed,1500000,USD,1500000,2023-09-28,,,Seed,,,,Yes,"NeuroTrainer measures, primes and optimizes the neural pathways that make high performers great.","Fitness, Health Care, Information Technology, Personal Health, Sports, Virtual Reality",,"San Francisco, California, United States, North America",https://neurotrainer.com/,$1M to $10M,8212499,USD,8212499,Seed,7,,,"61,041"
Seed Round - FlexDesk,https://www.crunchbase.com/funding_round/flexdesk-seed--065a5c9e,FlexDesk,https://www.crunchbase.com/organization/flexdesk,Seed,,,,2023-05-31,,"Alan Rutledge, Palm Drive Capital, Pioneer Fund, Seed Round Capital",Seed,,,,Yes,The next generation platform for corporate real estate teams,"Enterprise Software, Human Resources, Software",,"San Francisco, California, United States, North America",https://flexdesk.com,,500000,USD,500000,Seed,3,4,,"61,146"
Seed Round - Jupe,https://www.crunchbase.com/funding_round/jupe-seed--1060fa14,Jupe,https://www.crunchbase.com/organization/jupe,Seed,,,,2023-04-01,,Sahin Boydas,Seed,,,,Yes,Jupe is a housing technology startup that allows shelters to be instantly deployed on any available piece of land.,"GreenTech, Hospitality, Internet of Things, Outdoors, Real Estate, Software, Solar, Travel",Hispanic / Latine Founded,"San Francisco, California, United States, North America",http://www.jupe.com,$1M to $10M,9500000,USD,9500000,Seed,4,1,,"61,932"
Seed Round - Bridge,https://www.crunchbase.com/funding_round/bridge-6875-seed--a05e753a,Bridge,https://www.crunchbase.com/organization/bridge-6875,Seed,,,,2023-01-01,,Praxis,Seed,,,,Yes,"Bridge.do connects team's tools to capture real-time activity, surface relevant updates, and identify blockers.","Productivity Tools, Project Management, Task Management",,"San Francisco, California, United States, North America",https://www.bridge.do/,,,USD,,Seed,1,1,,"62,438"
Seed Round - Moonlight,https://www.crunchbase.com/funding_round/moonlight-db17-seed--4250426b,Moonlight,https://www.crunchbase.com/organization/moonlight-db17,Seed,150000,USD,150000,2023-06-20,,(ERA) Entrepreneurs Roundtable Accelerator,Seed,,,,Yes,Moonlight is an app to find flow state on demand.,"Application Performance Management, Artificial Intelligence (AI), Mobile Apps",,"San Francisco, California, United States, North America",https://www.moonlightfocus.com/,,150000,USD,150000,Seed,1,1,,"62,417"
Seed Round - DirtSat,https://www.crunchbase.com/funding_round/dirtsat-seed--a83f54c9,DirtSat,https://www.crunchbase.com/organization/dirtsat,Seed,150000,USD,150000,2023-06-20,,(ERA) Entrepreneurs Roundtable Accelerator,Seed,,,,Yes,DirtSat is a data and software platform for commercial property owners to manage the conversion of their unused rooftop space to Biosolar,"Information Technology, Internet of Things",,"San Francisco, California, United States, North America",https://www.dirtsat.com/,Less than $1M,150000,USD,150000,Seed,1,1,,"62,380"
Seed Round - Evergrow,https://www.crunchbase.com/funding_round/evergrow-d375-seed--2c5f29fc,Evergrow,https://www.crunchbase.com/organization/evergrow-d375,Seed,7000000,USD,7000000,2023-04-18,"Congruent Ventures, First Round Capital, Garuda Ventures, XYZ Venture Capital","Congruent Ventures, First Round Capital, Garuda Ventures, XYZ Venture Capital",Seed,,,,Yes,Evergrow is a climate fintech company that aims to be the first dedicated carbon offtake company.,"Finance, Financial Services, FinTech",,"San Francisco, California, United States, North America",https://evergrow.com/,$1M to $10M,14000000,USD,14000000,Seed,2,4,3,"62,415"
Seed Round - Zendata,https://www.crunchbase.com/funding_round/zendata-9215-seed--65ed9851,Zendata,https://www.crunchbase.com/organization/zendata-9215,Seed,150000,USD,150000,2023-06-20,,(ERA) Entrepreneurs Roundtable Accelerator,Seed,,,,Yes,AI that alerts you when your privacy fly is down,"Artificial Intelligence (AI), Compliance, Privacy, SaaS, Security, Software",,"San Francisco, California, United States, North America",https://www.zendata.xyz,,2075000,USD,2075000,Seed,5,1,,"62,353"
Seed Round - SPIRITT,https://www.crunchbase.com/funding_round/spiritt-seed--38c01ca0,SPIRITT,https://www.crunchbase.com/organization/spiritt,Seed,,,,2022-07-05,Disruptive AI Venture Capital,Disruptive AI Venture Capital,Seed,,,,Yes,SPIRITT is an AI based platform that translates an idea-description into a software-application,"Artificial Intelligence (AI), Information Technology, Software",,"San Francisco, California, United States, North America",https://spiritt.io,,13500000,USD,13500000,Seed,2,1,1,"62,622"
